{
  "$schema": "https://json-schema.org/draft/2020-12/schema",
  "$id": "https://ai-worldline.dev/schema/timeline.schema.json",
  "title": "AI Worldline timeline data",
  "type": "object",
  "required": ["meta", "lanes", "topics", "storylines", "periods", "events"],
  "properties": {
    "$schema": { "type": "string" },
    "meta": {
      "type": "object",
      "required": ["title", "version", "updatedAt", "currentPeriod", "scope"],
      "properties": {
        "title": { "type": "string", "minLength": 1 },
        "version": { "type": "string", "minLength": 1 },
        "updatedAt": { "type": "string", "format": "date" },
        "currentPeriod": { "type": "string", "pattern": "^[0-9]{4}-H[12]$" },
        "scope": { "type": "string", "minLength": 1 }
      },
      "additionalProperties": true
    },
    "lanes": {
      "type": "object",
      "additionalProperties": { "$ref": "#/$defs/taxonomyItem" }
    },
    "topics": {
      "type": "object",
      "additionalProperties": { "$ref": "#/$defs/taxonomyItem" }
    },
    "storylines": {
      "type": "array",
      "items": { "$ref": "#/$defs/storyline" },
      "minItems": 1
    },
    "periods": {
      "type": "array",
      "items": { "$ref": "#/$defs/period" },
      "minItems": 1
    },
    "events": {
      "type": "array",
      "items": { "$ref": "#/$defs/event" },
      "minItems": 1
    }
  },
  "$defs": {
    "taxonomyItem": {
      "type": "object",
      "required": ["label"],
      "properties": {
        "label": { "type": "string", "minLength": 1 },
        "caption": { "type": "string" },
        "color": { "type": "string" },
        "soft": { "type": "string" }
      },
      "additionalProperties": true
    },
    "period": {
      "type": "object",
      "required": ["id", "label"],
      "properties": {
        "id": { "type": "string", "pattern": "^[0-9]{4}-H[12]$" },
        "label": { "type": "string", "minLength": 1 },
        "status": { "type": "string", "enum": ["current", "watching", "complete"] }
      },
      "additionalProperties": true
    },
    "source": {
      "type": "object",
      "required": ["title", "publisher", "type"],
      "properties": {
        "title": { "type": "string", "minLength": 1 },
        "publisher": { "type": "string", "minLength": 1 },
        "date": { "type": "string" },
        "type": { "type": "string", "minLength": 1 },
        "url": { "type": "string", "format": "uri" },
        "fullText": { "type": "string", "format": "uri" }
      },
      "anyOf": [
        { "required": ["url"] },
        { "required": ["fullText"] }
      ],
      "additionalProperties": true
    },
    "storyNode": {
      "type": "object",
      "required": ["event", "label", "note"],
      "properties": {
        "event": { "type": "string", "pattern": "^[a-z0-9]+(?:-[a-z0-9]+)*$" },
        "label": { "type": "string", "minLength": 1 },
        "note": { "type": "string", "minLength": 1 }
      },
      "additionalProperties": false
    },
    "storyPhase": {
      "type": "object",
      "required": ["label", "nodes"],
      "properties": {
        "label": { "type": "string", "minLength": 1 },
        "nodes": {
          "type": "array",
          "items": { "$ref": "#/$defs/storyNode" },
          "minItems": 1
        }
      },
      "additionalProperties": false
    },
    "storyline": {
      "type": "object",
      "required": ["id", "title", "summary", "conclusionTitle", "conclusion", "phases"],
      "properties": {
        "id": { "type": "string", "pattern": "^[a-z0-9]+(?:-[a-z0-9]+)*$" },
        "title": { "type": "string", "minLength": 1 },
        "summary": { "type": "string", "minLength": 1 },
        "conclusionTitle": { "type": "string", "minLength": 1 },
        "conclusion": { "type": "string", "minLength": 1 },
        "phases": {
          "type": "array",
          "items": { "$ref": "#/$defs/storyPhase" },
          "minItems": 1
        }
      },
      "additionalProperties": false
    },
    "event": {
      "type": "object",
      "required": ["id", "period", "date", "lane", "topics", "title", "short", "what", "why", "changed", "concepts", "orgs", "sources"],
      "properties": {
        "id": { "type": "string", "pattern": "^[a-z0-9]+(?:-[a-z0-9]+)*$" },
        "period": { "type": "string", "pattern": "^[0-9]{4}-H[12]$" },
        "date": { "type": "string", "format": "date" },
        "lane": { "type": "string", "enum": ["event", "tech"] },
        "topics": {
          "type": "array",
          "items": { "type": "string", "minLength": 1 },
          "uniqueItems": true
        },
        "title": { "type": "string", "minLength": 1 },
        "short": { "type": "string", "minLength": 1 },
        "what": { "type": "string", "minLength": 1 },
        "why": { "type": "string", "minLength": 1 },
        "changed": { "type": "string", "minLength": 1 },
        "concepts": { "type": "array", "items": { "type": "string" } },
        "orgs": { "type": "array", "items": { "type": "string" } },
        "importance": { "type": "string", "enum": ["major", "normal"] },
        "status": { "type": "string", "enum": ["watching", "complete"] },
        "sources": {
          "type": "array",
          "items": { "$ref": "#/$defs/source" },
          "minItems": 1
        }
      },
      "additionalProperties": true
    }
  },
  "additionalProperties": false
}
