{
  "$schema": "./schema.json",
  "meta": {
    "title": "AI 世界线",
    "version": "1.1.0",
    "updatedAt": "2026-09-02",
    "currentPeriod": "2026-H2",
    "scope": "A curated, source-first timeline of the modern foundation-model, agent, and world-model era."
  },
  "lanes": {
    "event": {
      "label": "事件",
      "caption": "商业、公司与机构的重要进展",
      "color": "#0b0f18",
      "soft": "#eef1f5"
    },
    "tech": {
      "label": "技术",
      "caption": "研究、架构与开源突破",
      "color": "#0f5eea",
      "soft": "#e9f0ff"
    }
  },
  "topics": {
    "world-model": {
      "label": "世界模型",
      "caption": "理解、预测、规划与生成可交互世界",
      "color": "#087e87",
      "soft": "#e7f5f4"
    },
    "moe": {
      "label": "MoE",
      "caption": "稀疏激活与专家路由",
      "color": "#6657c8",
      "soft": "#f0edff"
    },
    "agentic-software": {
      "label": "Agent 软件",
      "caption": "从编程助手、工具协议到可持续运行的 Agent 系统",
      "color": "#135fd1",
      "soft": "#eaf1ff"
    }
  },
  "storylines": [
    {
      "id": "language-models-to-agents",
      "title": "语言模型如何变成行动者",
      "summary": "从预测下一个词，到调用工具、保持状态并进入真实工作。",
      "conclusionTitle": "这条线真正改变了什么",
      "conclusion": "模型不再只是回答问题，而是开始在环境里完成工作。",
      "phases": [
        {
          "label": "表示",
          "nodes": [
            {
              "event": "attention-is-all-you-need",
              "label": "Attention",
              "note": "注意力让模型在序列中按需连接信息。"
            },
            {
              "event": "gpt-3",
              "label": "GPT-3",
              "note": "规模化预训练展现通用任务迁移能力。"
            }
          ]
        },
        {
          "label": "对齐",
          "nodes": [
            {
              "event": "instructgpt",
              "label": "InstructGPT",
              "note": "人类反馈把续写模型变成可协作助手。"
            }
          ]
        },
        {
          "label": "行动",
          "nodes": [
            {
              "event": "react",
              "label": "ReAct",
              "note": "推理轨迹与外部行动第一次形成循环。"
            },
            {
              "event": "function-calling",
              "label": "Function Calling",
              "note": "模型用结构化参数可靠调用外部能力。"
            },
            {
              "event": "mcp",
              "label": "MCP",
              "note": "工具与上下文接入开始拥有共同协议。"
            }
          ]
        },
        {
          "label": "运行时",
          "nodes": [
            {
              "event": "agent-skills",
              "label": "Agent Skills",
              "note": "专业方法被封装为可复用的运行时能力。"
            },
            {
              "event": "effective-harnesses",
              "label": "Harness",
              "note": "状态、测试与反馈机制决定 Agent 的可靠性。"
            },
            {
              "event": "managed-agents",
              "label": "Managed Agents",
              "note": "Session、Harness 与 Sandbox 成为基础设施。"
            }
          ]
        }
      ]
    },
    {
      "id": "coding-as-agent-workplace",
      "title": "编程为什么成为 Agent 的第一个原生工作场",
      "summary": "代码天然拥有目标、反馈、测试和版本历史，让 Agent 能够闭环工作。",
      "conclusionTitle": "为什么第一个工作场是代码",
      "conclusion": "编程环境把任务、工具与可验证反馈放在一起，最早让模型从建议者变成执行者。",
      "phases": [
        {
          "label": "新范式",
          "nodes": [
            {
              "event": "software-2",
              "label": "Software 2.0",
              "note": "软件的一部分开始由数据和训练塑造。"
            }
          ]
        },
        {
          "label": "结对",
          "nodes": [
            {
              "event": "github-copilot",
              "label": "GitHub Copilot",
              "note": "代码生成第一次进入日常编辑器工作流。"
            },
            {
              "event": "codex-paper",
              "label": "Codex",
              "note": "自然语言与可执行代码形成稳定映射。"
            }
          ]
        },
        {
          "label": "编辑器",
          "nodes": [
            {
              "event": "cursor-breakout",
              "label": "Cursor",
              "note": "AI 原生编辑器把上下文与修改动作连起来。"
            },
            {
              "event": "vibe-coding",
              "label": "Vibe Coding",
              "note": "描述意图开始替代部分手写实现。"
            }
          ]
        },
        {
          "label": "Agent 工作场",
          "nodes": [
            {
              "event": "claude-code",
              "label": "Claude Code",
              "note": "终端中的 Agent 可以搜索、修改并验证代码。"
            },
            {
              "event": "codex-agent",
              "label": "Codex Cloud",
              "note": "编码任务转向隔离环境中的异步执行。"
            },
            {
              "event": "harness-design",
              "label": "Harness Engineering",
              "note": "工作制度与反馈回路成为性能杠杆。"
            }
          ]
        }
      ]
    },
    {
      "id": "models-learn-the-world",
      "title": "模型为什么开始学习世界",
      "summary": "从在潜在空间里想象，到预测抽象状态并实时生成可交互环境。",
      "conclusionTitle": "世界不再只是输出内容",
      "conclusion": "当模型能够预测行动之后的世界，它就同时成为训练环境、规划器与新型创作介质。",
      "phases": [
        {
          "label": "想象中学习",
          "nodes": [
            {
              "event": "world-models",
              "label": "World Models",
              "note": "Agent 首次在学出来的环境内部训练策略。"
            },
            {
              "event": "dreamer",
              "label": "Dreamer",
              "note": "潜在动力学开始支撑高效的策略学习。"
            },
            {
              "event": "dreamerv2",
              "label": "DreamerV2",
              "note": "离散潜在状态连接了控制与 token 建模。"
            }
          ]
        },
        {
          "label": "预测抽象",
          "nodes": [
            {
              "event": "jepa-blueprint",
              "label": "JEPA",
              "note": "预测目标从像素转向可规划的抽象表示。"
            },
            {
              "event": "v-jepa",
              "label": "V-JEPA",
              "note": "视频中的可预测结构成为世界知识来源。"
            }
          ]
        },
        {
          "label": "生成世界",
          "nodes": [
            {
              "event": "genie-1",
              "label": "Genie",
              "note": "互联网视频被学习为可行动的平台世界。"
            },
            {
              "event": "oasis",
              "label": "Oasis",
              "note": "实时可操作世界第一次成为大众体验。"
            }
          ]
        },
        {
          "label": "通用模拟",
          "nodes": [
            {
              "event": "nvidia-cosmos",
              "label": "Cosmos",
              "note": "世界模型被定位为 Physical AI 基础设施。"
            },
            {
              "event": "genie-3",
              "label": "Genie 3",
              "note": "开放场景进入实时、持续和可提示交互。"
            }
          ]
        }
      ]
    }
  ],
  "periods": [
    {
      "id": "2017-H1",
      "label": "2017 H1"
    },
    {
      "id": "2017-H2",
      "label": "2017 H2"
    },
    {
      "id": "2018-H1",
      "label": "2018 H1"
    },
    {
      "id": "2018-H2",
      "label": "2018 H2"
    },
    {
      "id": "2019-H1",
      "label": "2019 H1"
    },
    {
      "id": "2019-H2",
      "label": "2019 H2"
    },
    {
      "id": "2020-H1",
      "label": "2020 H1"
    },
    {
      "id": "2020-H2",
      "label": "2020 H2"
    },
    {
      "id": "2021-H1",
      "label": "2021 H1"
    },
    {
      "id": "2021-H2",
      "label": "2021 H2"
    },
    {
      "id": "2022-H1",
      "label": "2022 H1"
    },
    {
      "id": "2022-H2",
      "label": "2022 H2"
    },
    {
      "id": "2023-H1",
      "label": "2023 H1"
    },
    {
      "id": "2023-H2",
      "label": "2023 H2"
    },
    {
      "id": "2024-H1",
      "label": "2024 H1"
    },
    {
      "id": "2024-H2",
      "label": "2024 H2"
    },
    {
      "id": "2025-H1",
      "label": "2025 H1"
    },
    {
      "id": "2025-H2",
      "label": "2025 H2"
    },
    {
      "id": "2026-H1",
      "label": "2026 H1"
    },
    {
      "id": "2026-H2",
      "label": "2026 H2",
      "status": "current"
    }
  ],
  "events": [
    {
      "id": "attention-is-all-you-need",
      "period": "2017-H1",
      "date": "2017-06-12",
      "lane": "tech",
      "importance": "major",
      "title": "Attention Is All You Need",
      "short": "Transformer 架构出现",
      "what": "Google 研究团队提出完全基于注意力机制的 Transformer，摆脱循环神经网络对序列计算的依赖。",
      "why": "它让大规模并行训练语言模型变得更可行，并成为此后 GPT、BERT 与现代多模态模型的共同底座。",
      "changed": "AI 的核心竞争开始从手工任务架构转向通用架构、数据与算力的规模化组合。",
      "concepts": [
        "Transformer",
        "Self-Attention",
        "Pretraining"
      ],
      "orgs": [
        "Google Brain",
        "Google Research"
      ],
      "sources": [
        {
          "title": "Attention Is All You Need",
          "publisher": "Vaswani et al. · arXiv",
          "date": "2017-06-12",
          "type": "paper",
          "url": "https://arxiv.org/abs/1706.03762",
          "fullText": "https://arxiv.org/pdf/1706.03762"
        }
      ],
      "topics": []
    },
    {
      "id": "software-2",
      "period": "2017-H2",
      "date": "2017-11-11",
      "lane": "tech",
      "title": "Software 2.0",
      "short": "程序开始由数据训练出来",
      "what": "Andrej Karpathy 用 Software 2.0 描述一种新软件：行为不再主要由人逐行编写，而由数据和优化过程训练得到。",
      "why": "它为后来“模型即软件”“自然语言编程”和 Agent 工作流提供了一条非常早的解释线索。",
      "changed": "开发者开始把模型、数据集和训练过程视为新的软件工程材料。",
      "concepts": [
        "Software 2.0",
        "Learned Programs"
      ],
      "orgs": [
        "Andrej Karpathy"
      ],
      "sources": [
        {
          "title": "Software 2.0",
          "publisher": "Andrej Karpathy",
          "date": "2017-11-11",
          "type": "essay",
          "url": "https://karpathy.medium.com/software-2-0-a64152b37c35"
        }
      ],
      "topics": [
        "agentic-software"
      ]
    },
    {
      "id": "sparsely-gated-moe",
      "period": "2017-H1",
      "date": "2017-01-23",
      "lane": "tech",
      "importance": "major",
      "title": "稀疏门控 MoE",
      "short": "只激活部分专家，容量不再等于计算量",
      "what": "Google 研究团队提出 Sparsely-Gated Mixture-of-Experts 层，用可训练门控网络为每个输入选择少量前馈专家。",
      "why": "它让模型能够拥有极大的总参数容量，却不必让每个 token 都经过全部参数。",